{
  "handoffVersion": "1.0.0",
  "lifecycleStatus": "Synthetic correction fixture; human correction requested but not yet applied.",
  "reviewNotes": [
    "remove unsupported approval",
    "Session facts: {\"process\":\"returns authorization\",\"identities\":[\"inspect\",\"choose-remedy\",\"refund\",\"replacement\"],\"unsupported\":\"warehouse approval\",\"correction\":\"remove unsupported approval\"}"
  ],
  "request": {
    "schemaVersion": "1.0.0",
    "profileVersion": "1.0.0",
    "model": {
      "key": "returns-authorization-model",
      "name": "returns authorization",
      "primaryRef": "returns-authorization",
      "processes": [
        {
          "key": "returns-authorization",
          "name": "returns authorization",
          "nodes": [
            {
              "key": "session-start",
              "type": "startEvent",
              "containerRef": "returns-authorization",
              "name": "Return requested",
              "event": {
                "kind": "none"
              }
            },
            {
              "key": "inspect",
              "type": "task",
              "containerRef": "returns-authorization",
              "name": "Inspect returned item"
            },
            {
              "key": "warehouse-approval",
              "type": "task",
              "containerRef": "returns-authorization",
              "name": "Obtain warehouse approval",
              "documentation": "This step is present in the baseline but unsupported by the source and targeted for removal."
            },
            {
              "key": "choose-remedy",
              "type": "exclusiveGateway",
              "containerRef": "returns-authorization",
              "name": "Refund or replacement?",
              "defaultFlowRef": "replacement-route"
            },
            {
              "key": "refund",
              "type": "task",
              "containerRef": "returns-authorization",
              "name": "Issue refund"
            },
            {
              "key": "replacement",
              "type": "task",
              "containerRef": "returns-authorization",
              "name": "Send replacement"
            },
            {
              "key": "refund-end",
              "type": "endEvent",
              "containerRef": "returns-authorization",
              "name": "Refund completed",
              "event": {
                "kind": "none"
              }
            },
            {
              "key": "replacement-end",
              "type": "endEvent",
              "containerRef": "returns-authorization",
              "name": "Replacement completed",
              "event": {
                "kind": "none"
              }
            }
          ],
          "flows": [
            {
              "key": "return-start",
              "containerRef": "returns-authorization",
              "sourceRef": "session-start",
              "targetRef": "inspect"
            },
            {
              "key": "inspection-complete",
              "containerRef": "returns-authorization",
              "sourceRef": "inspect",
              "targetRef": "warehouse-approval"
            },
            {
              "key": "approval-complete",
              "containerRef": "returns-authorization",
              "sourceRef": "warehouse-approval",
              "targetRef": "choose-remedy"
            },
            {
              "key": "refund-route",
              "containerRef": "returns-authorization",
              "sourceRef": "choose-remedy",
              "targetRef": "refund",
              "name": "Refund selected",
              "condition": "remedy = refund"
            },
            {
              "key": "replacement-route",
              "containerRef": "returns-authorization",
              "sourceRef": "choose-remedy",
              "targetRef": "replacement",
              "name": "Otherwise"
            },
            {
              "key": "refund-complete",
              "containerRef": "returns-authorization",
              "sourceRef": "refund",
              "targetRef": "refund-end"
            },
            {
              "key": "replacement-complete",
              "containerRef": "returns-authorization",
              "sourceRef": "replacement",
              "targetRef": "replacement-end"
            }
          ],
          "lanes": [
            {
              "key": "returns-team",
              "name": "Returns team",
              "parentRef": "returns-authorization",
              "flowNodeRefs": [
                "session-start",
                "inspect",
                "warehouse-approval",
                "choose-remedy",
                "refund",
                "replacement",
                "refund-end",
                "replacement-end"
              ]
            }
          ]
        }
      ]
    },
    "evidence": [
      {
        "key": "session-account",
        "source": "Synthetic session account",
        "summary": "{\"process\":\"returns authorization\",\"identities\":[\"inspect\",\"choose-remedy\",\"refund\",\"replacement\"],\"unsupported\":\"warehouse approval\",\"correction\":\"remove unsupported approval\"}"
      }
    ],
    "links": [
      {
        "elementRef": "inspect",
        "assertion": "Retain the existing inspect identity unless the correction names it.",
        "basis": "evidence",
        "supportRefs": [
          "session-account"
        ]
      },
      {
        "elementRef": "choose-remedy",
        "assertion": "Retain the existing choose-remedy identity unless the correction names it.",
        "basis": "evidence",
        "supportRefs": [
          "session-account"
        ]
      },
      {
        "elementRef": "refund",
        "assertion": "Retain the existing refund identity unless the correction names it.",
        "basis": "evidence",
        "supportRefs": [
          "session-account"
        ]
      },
      {
        "elementRef": "replacement",
        "assertion": "Retain the existing replacement identity unless the correction names it.",
        "basis": "evidence",
        "supportRefs": [
          "session-account"
        ]
      },
      {
        "elementRef": "warehouse-approval",
        "assertion": "The baseline contains the unsupported warehouse approval targeted for removal.",
        "basis": "evidence",
        "supportRefs": [
          "session-account"
        ]
      },
      {
        "elementRef": "returns-team",
        "assertion": "The returns team owns the supplied baseline activities.",
        "basis": "evidence",
        "supportRefs": [
          "session-account"
        ]
      },
      {
        "elementRef": "refund-route",
        "assertion": "Refund is one mutually exclusive remedy route.",
        "basis": "evidence",
        "supportRefs": [
          "session-account"
        ]
      }
    ]
  }
}
