{
  "handoffVersion": "1.0.0",
  "lifecycleStatus": "Synthetic correction fixture; human correction requested but not yet applied.",
  "reviewNotes": [
    "EUR 7,500 inclusive; rename Create purchase order to Prepare purchase order",
    "Session facts: {\"process\":\"purchase approval\",\"identities\":[\"check\",\"budget-approval\",\"finance-approval\",\"prepare-po\"],\"threshold\":\"EUR 5,000 inclusive\",\"correction\":\"EUR 7,500 inclusive; rename Create purchase order to Prepare purchase order\"}"
  ],
  "request": {
    "schemaVersion": "1.0.0",
    "profileVersion": "1.0.0",
    "model": {
      "key": "purchase-approval-model",
      "name": "purchase approval",
      "primaryRef": "purchase-approval",
      "processes": [
        {
          "key": "purchase-approval",
          "name": "purchase approval",
          "nodes": [
            {
              "key": "session-start",
              "type": "startEvent",
              "containerRef": "purchase-approval",
              "name": "Purchase requested",
              "event": {
                "kind": "none"
              }
            },
            {
              "key": "check",
              "type": "task",
              "containerRef": "purchase-approval",
              "name": "Check request"
            },
            {
              "key": "approval-threshold",
              "type": "exclusiveGateway",
              "containerRef": "purchase-approval",
              "name": "At least EUR 5,000?",
              "defaultFlowRef": "below-threshold"
            },
            {
              "key": "finance-approval",
              "type": "task",
              "containerRef": "purchase-approval",
              "name": "Obtain finance approval"
            },
            {
              "key": "prepare-po",
              "type": "task",
              "containerRef": "purchase-approval",
              "name": "Create purchase order"
            },
            {
              "key": "session-end",
              "type": "endEvent",
              "containerRef": "purchase-approval",
              "name": "Purchase order ready",
              "event": {
                "kind": "none"
              }
            }
          ],
          "flows": [
            {
              "key": "purchase-start",
              "containerRef": "purchase-approval",
              "sourceRef": "session-start",
              "targetRef": "check"
            },
            {
              "key": "request-checked",
              "containerRef": "purchase-approval",
              "sourceRef": "check",
              "targetRef": "approval-threshold"
            },
            {
              "key": "approval-required",
              "containerRef": "purchase-approval",
              "sourceRef": "approval-threshold",
              "targetRef": "finance-approval",
              "name": "EUR 5,000 or more",
              "condition": "amount >= 5000"
            },
            {
              "key": "below-threshold",
              "containerRef": "purchase-approval",
              "sourceRef": "approval-threshold",
              "targetRef": "prepare-po",
              "name": "Below EUR 5,000"
            },
            {
              "key": "approval-complete",
              "containerRef": "purchase-approval",
              "sourceRef": "finance-approval",
              "targetRef": "prepare-po"
            },
            {
              "key": "order-created",
              "containerRef": "purchase-approval",
              "sourceRef": "prepare-po",
              "targetRef": "session-end"
            }
          ],
          "lanes": [
            {
              "key": "purchasing",
              "name": "Purchasing",
              "parentRef": "purchase-approval",
              "flowNodeRefs": [
                "session-start",
                "check",
                "approval-threshold",
                "prepare-po",
                "session-end"
              ]
            },
            {
              "key": "finance",
              "name": "Finance",
              "parentRef": "purchase-approval",
              "flowNodeRefs": [
                "finance-approval"
              ]
            }
          ]
        }
      ]
    },
    "evidence": [
      {
        "key": "session-account",
        "source": "Synthetic session account",
        "summary": "{\"process\":\"purchase approval\",\"identities\":[\"check\",\"budget-approval\",\"finance-approval\",\"prepare-po\"],\"threshold\":\"EUR 5,000 inclusive\",\"correction\":\"EUR 7,500 inclusive; rename Create purchase order to Prepare purchase order\"}"
      }
    ],
    "links": [
      {
        "elementRef": "check",
        "assertion": "Retain the existing check identity unless the correction names it.",
        "basis": "evidence",
        "supportRefs": [
          "session-account"
        ]
      },
      {
        "elementRef": "approval-threshold",
        "assertion": "Retain the inclusive threshold decision identity.",
        "basis": "evidence",
        "supportRefs": [
          "session-account"
        ]
      },
      {
        "elementRef": "finance-approval",
        "assertion": "Retain the existing finance-approval identity unless the correction names it.",
        "basis": "evidence",
        "supportRefs": [
          "session-account"
        ]
      },
      {
        "elementRef": "prepare-po",
        "assertion": "Retain the existing prepare-po identity unless the correction names it.",
        "basis": "evidence",
        "supportRefs": [
          "session-account"
        ]
      },
      {
        "elementRef": "purchasing",
        "assertion": "Purchasing owns request checking and purchase-order preparation.",
        "basis": "evidence",
        "supportRefs": [
          "session-account"
        ]
      },
      {
        "elementRef": "finance",
        "assertion": "Finance owns finance approval.",
        "basis": "evidence",
        "supportRefs": [
          "session-account"
        ]
      },
      {
        "elementRef": "approval-required",
        "assertion": "The original inclusive threshold is EUR 5,000.",
        "basis": "evidence",
        "supportRefs": [
          "session-account"
        ]
      },
      {
        "elementRef": "below-threshold",
        "assertion": "Amounts below EUR 5,000 follow the complementary route.",
        "basis": "evidence",
        "supportRefs": [
          "session-account"
        ]
      }
    ]
  }
}
